"conceptSetId","conceptSetName","conceptId","conceptName","standardConcept","invalidReason","conceptCode","vocabularyId"
67,"[C02][AI2] Rheumatoid Arthritis",80809,"Rheumatoid arthritis","S","V","69896004","SNOMED"
67,"[C02][AI2] Rheumatoid Arthritis",81097,"Felty's syndrome","S","V","57160007","SNOMED"
67,"[C02][AI2] Rheumatoid Arthritis",601030,"Left ankle seropositive rheumatoid arthritis","S","V","318841000119100","SNOMED"
67,"[C02][AI2] Rheumatoid Arthritis",601031,"Left elbow seropositive rheumatoid arthritis","S","V","318851000119103","SNOMED"
67,"[C02][AI2] Rheumatoid Arthritis",601032,"Seropositive rheumatoid arthritis of left hand","S","V","318861000119101","SNOMED"
67,"[C02][AI2] Rheumatoid Arthritis",601033,"Seropositive rheumatoid arthritis of joint of left shoulder region","S","V","318891000119108","SNOMED"
67,"[C02][AI2] Rheumatoid Arthritis",601034,"Left wrist region seropositive rheumatoid arthritis","S","V","318901000119107","SNOMED"
67,"[C02][AI2] Rheumatoid Arthritis",601035,"Right ankle seropositive rheumatoid arthritis","S","V","318911000119105","SNOMED"
67,"[C02][AI2] Rheumatoid Arthritis",601036,"Right elbow seropositive rheumatoid arthritis","S","V","318921000119103","SNOMED"
67,"[C02][AI2] Rheumatoid Arthritis",601037,"Seropositive rheumatoid arthritis of joint of right shoulder region","S","V","318961000119108","SNOMED"
67,"[C02][AI2] Rheumatoid Arthritis",601038,"Right wrist region seropositive rheumatoid arthritis","S","V","318971000119102","SNOMED"
67,"[C02][AI2] Rheumatoid Arthritis",601039,"Seronegative rheumatoid arthritis of joint of left ankle","S","V","319011000119103","SNOMED"
67,"[C02][AI2] Rheumatoid Arthritis",601040,"Left hip joint seronegative rheumatoid arthritis","S","V","319041000119104","SNOMED"
67,"[C02][AI2] Rheumatoid Arthritis",601041,"Seronegative rheumatoid arthritis of left knee joint","S","V","319051000119102","SNOMED"
67,"[C02][AI2] Rheumatoid Arthritis",601042,"Left shoulder region seronegative rheumatoid arthritis","S","V","319061000119100","SNOMED"
67,"[C02][AI2] Rheumatoid Arthritis",601043,"Left wrist region seronegative rheumatoid arthritis","S","V","319071000119106","SNOMED"
67,"[C02][AI2] Rheumatoid Arthritis",601044,"Seronegative rheumatoid arthritis of joint of right ankle","S","V","319091000119107","SNOMED"
67,"[C02][AI2] Rheumatoid Arthritis",601045,"Right hip joint seronegative rheumatoid arthritis","S","V","319121000119106","SNOMED"
67,"[C02][AI2] Rheumatoid Arthritis",601046,"Seronegative rheumatoid arthritis of right knee joint","S","V","319131000119109","SNOMED"
67,"[C02][AI2] Rheumatoid Arthritis",601047,"Right shoulder region seronegative rheumatoid arthritis","S","V","319141000119100","SNOMED"
67,"[C02][AI2] Rheumatoid Arthritis",601048,"Right wrist region seronegative rheumatoid arthritis","S","V","319151000119103","SNOMED"
67,"[C02][AI2] Rheumatoid Arthritis",603298,"Bilateral seropositive rheumatoid arthritis of shoulder regions","S","V","15691841000119102","SNOMED"
67,"[C02][AI2] Rheumatoid Arthritis",603299,"Bilateral seropositive rheumatoid arthritis of knees","S","V","15691881000119107","SNOMED"
67,"[C02][AI2] Rheumatoid Arthritis",603300,"Bilateral seropositive rheumatoid arthritis of hip joints","S","V","15691921000119100","SNOMED"
67,"[C02][AI2] Rheumatoid Arthritis",603301,"Bilateral seropositive rheumatoid arthritis of ankle joints","S","V","15691961000119105","SNOMED"
67,"[C02][AI2] Rheumatoid Arthritis",603302,"Bilateral seropositive rheumatoid arthritis of joint of elbows","S","V","15692001000119101","SNOMED"
67,"[C02][AI2] Rheumatoid Arthritis",603308,"Seronegative rheumatoid arthritis in remission","S","V","16606681000119101","SNOMED"
67,"[C02][AI2] Rheumatoid Arthritis",603309,"Seropositive rheumatoid arthritis in remission","S","V","16606721000119107","SNOMED"
67,"[C02][AI2] Rheumatoid Arthritis",605413,"Right foot seropositive rheumatoid arthritis","S","V","1073601000119101","SNOMED"
67,"[C02][AI2] Rheumatoid Arthritis",605414,"Left foot seropositive rheumatoid arthritis","S","V","1073611000119103","SNOMED"
67,"[C02][AI2] Rheumatoid Arthritis",607144,"Isolated nailfold rheumatoid vasculitis","S","V","1149218009","SNOMED"
67,"[C02][AI2] Rheumatoid Arthritis",607145,"Systemic rheumatoid vasculitis","S","V","1149219001","SNOMED"
67,"[C02][AI2] Rheumatoid Arthritis",608809,"Bilateral seronegative rheumatoid arthritis of feet","S","V","15691081000119100","SNOMED"
67,"[C02][AI2] Rheumatoid Arthritis",608810,"Bilateral seronegative rheumatoid arthritis of elbow joints","S","V","15691121000119103","SNOMED"
67,"[C02][AI2] Rheumatoid Arthritis",608811,"Bilateral seronegative rheumatoid arthritis of knees","S","V","15691241000119101","SNOMED"
67,"[C02][AI2] Rheumatoid Arthritis",608812,"Bilateral seronegative rheumatoid arthritis of wrists","S","V","15691321000119101","SNOMED"
67,"[C02][AI2] Rheumatoid Arthritis",608813,"Bilateral seropositive rheumatoid arthritis of wrist joint regions","S","V","15692041000119104","SNOMED"
67,"[C02][AI2] Rheumatoid Arthritis",609024,"Bilateral seropositive rheumatoid arthritis of feet","S","V","16050071000119108","SNOMED"
67,"[C02][AI2] Rheumatoid Arthritis",609061,"Seropositive rheumatoid arthritis of right hand","S","V","318931000119100","SNOMED"
67,"[C02][AI2] Rheumatoid Arthritis",1076884,"Seronegative rheumatoid arthritis of elbow joint","S","V","299271000119109","SNOMED"
67,"[C02][AI2] Rheumatoid Arthritis",1076984,"Seronegative rheumatoid arthritis of left elbow joint","S","V","319021000119105","SNOMED"
67,"[C02][AI2] Rheumatoid Arthritis",1076985,"Seronegative rheumatoid arthritis of right elbow joint","S","V","319101000119102","SNOMED"
67,"[C02][AI2] Rheumatoid Arthritis",1244750,"Seronegative rheumatoid arthritis of joint of shoulder region","S","V","1290768009","SNOMED"
67,"[C02][AI2] Rheumatoid Arthritis",1245533,"Rheumatoid arthritis of bilateral glenohumeral joints","S","V","15686241000119106","SNOMED"
67,"[C02][AI2] Rheumatoid Arthritis",1245541,"Seronegative rheumatoid arthritis of joint of bilateral shoulder regions","S","V","15691281000119106","SNOMED"
67,"[C02][AI2] Rheumatoid Arthritis",1245542,"Seronegative rheumatoid arthritis of bilateral hip joints","S","V","15691361000119106","SNOMED"
67,"[C02][AI2] Rheumatoid Arthritis",1340460,"Exacerbation of rheumatoid arthritis","S","V","OMOP5166115","OMOP Extension"
67,"[C02][AI2] Rheumatoid Arthritis",1340523,"Progression of rheumatoid arthritis","S","V","OMOP5166178","OMOP Extension"
67,"[C02][AI2] Rheumatoid Arthritis",2107558,"Rheumatoid arthritis (RA) disease activity, low (RA)","S","V","3470F","CPT4"
67,"[C02][AI2] Rheumatoid Arthritis",2107559,"Rheumatoid arthritis (RA) disease activity, moderate (RA)","S","V","3471F","CPT4"
67,"[C02][AI2] Rheumatoid Arthritis",2107560,"Rheumatoid arthritis (RA) disease activity, high (RA)","S","V","3472F","CPT4"
67,"[C02][AI2] Rheumatoid Arthritis",4030424,"Rheumatoid osteoperiostitis","S","V","129563009","SNOMED"
67,"[C02][AI2] Rheumatoid Arthritis",4035611,"Seropositive rheumatoid arthritis","S","V","239791005","SNOMED"
67,"[C02][AI2] Rheumatoid Arthritis",4083556,"Seronegative rheumatoid arthritis","S","V","239792003","SNOMED"
67,"[C02][AI2] Rheumatoid Arthritis",4103516,"Rheumatoid carditis","S","V","28880005","SNOMED"
67,"[C02][AI2] Rheumatoid Arthritis",4114439,"Rheumatoid arthritis of shoulder","S","V","201766009","SNOMED"
67,"[C02][AI2] Rheumatoid Arthritis",4114440,"Rheumatoid arthritis of distal interphalangeal joint of finger","S","V","201774005","SNOMED"
67,"[C02][AI2] Rheumatoid Arthritis",4114441,"Rheumatoid arthritis of first metatarsophalangeal joint","S","V","201783000","SNOMED"
67,"[C02][AI2] Rheumatoid Arthritis",4114442,"Rheumatoid arthritis of interphalangeal joint of toe","S","V","201785007","SNOMED"
67,"[C02][AI2] Rheumatoid Arthritis",4114444,"Flare of rheumatoid arthritis","S","V","201791009","SNOMED"
67,"[C02][AI2] Rheumatoid Arthritis",4115050,"Rheumatoid arthritis of distal radioulnar joint","S","V","201770001","SNOMED"
67,"[C02][AI2] Rheumatoid Arthritis",4115051,"Rheumatoid arthritis of tibiofibular joint","S","V","201778008","SNOMED"
67,"[C02][AI2] Rheumatoid Arthritis",4115161,"Rheumatoid arthritis - hand joint","S","V","287007001","SNOMED"
67,"[C02][AI2] Rheumatoid Arthritis",4116148,"Rheumatoid arthritis of sternoclavicular joint","S","V","201767000","SNOMED"
67,"[C02][AI2] Rheumatoid Arthritis",4116149,"Rheumatoid arthritis of acromioclavicular joint","S","V","201768005","SNOMED"
67,"[C02][AI2] Rheumatoid Arthritis",4116150,"Rheumatoid arthritis of hip","S","V","201775006","SNOMED"
67,"[C02][AI2] Rheumatoid Arthritis",4116151,"Rheumatoid arthritis of knee","S","V","201777003","SNOMED"
67,"[C02][AI2] Rheumatoid Arthritis",4116152,"Rheumatoid arthritis of talonavicular joint","S","V","201781003","SNOMED"
67,"[C02][AI2] Rheumatoid Arthritis",4116153,"Rheumatoid arthritis of lesser metatarsophalangeal joint","S","V","201784006","SNOMED"
67,"[C02][AI2] Rheumatoid Arthritis",4116439,"Rheumatoid arthritis of cervical spine","S","V","201764007","SNOMED"
67,"[C02][AI2] Rheumatoid Arthritis",4116440,"Rheumatoid arthritis of elbow","S","V","201769002","SNOMED"
67,"[C02][AI2] Rheumatoid Arthritis",4116441,"Rheumatoid arthritis of wrist","S","V","201771002","SNOMED"
67,"[C02][AI2] Rheumatoid Arthritis",4116442,"Rheumatoid arthritis of metacarpophalangeal joint","S","V","201772009","SNOMED"
67,"[C02][AI2] Rheumatoid Arthritis",4116443,"Rheumatoid arthritis of proximal interphalangeal joint of finger","S","V","201773004","SNOMED"
67,"[C02][AI2] Rheumatoid Arthritis",4116444,"Rheumatoid arthritis of sacroiliac joint","S","V","201776007","SNOMED"
67,"[C02][AI2] Rheumatoid Arthritis",4116445,"Rheumatoid arthritis of ankle","S","V","201779000","SNOMED"
67,"[C02][AI2] Rheumatoid Arthritis",4116446,"Rheumatoid arthritis of subtalar joint","S","V","201780002","SNOMED"
67,"[C02][AI2] Rheumatoid Arthritis",4117686,"Rheumatoid arthritis of multiple joints","S","V","287006005","SNOMED"
67,"[C02][AI2] Rheumatoid Arthritis",4117687,"Rheumatoid arthritis - ankle and/or foot","S","V","287008006","SNOMED"
67,"[C02][AI2] Rheumatoid Arthritis",4147418,"Seropositive erosive rheumatoid arthritis","S","V","308143008","SNOMED"
67,"[C02][AI2] Rheumatoid Arthritis",4162539,"Rheumatoid arthritis with pneumoconiosis","S","V","398640008","SNOMED"
67,"[C02][AI2] Rheumatoid Arthritis",4179378,"Rheumatoid arthritis of foot","S","V","429192004","SNOMED"
67,"[C02][AI2] Rheumatoid Arthritis",4179536,"Rheumatoid arthritis of temporomandibular joint","S","V","427770001","SNOMED"
67,"[C02][AI2] Rheumatoid Arthritis",4243509,"Rheumatoid scleritis","S","V","59165007","SNOMED"
67,"[C02][AI2] Rheumatoid Arthritis",4269880,"Rheumatoid arteritis","S","V","399923009","SNOMED"
67,"[C02][AI2] Rheumatoid Arthritis",4271003,"Rheumatoid vasculitis","S","V","400054000","SNOMED"
67,"[C02][AI2] Rheumatoid Arthritis",4296152,"Rheumatoid pericarditis","S","V","7607008","SNOMED"
67,"[C02][AI2] Rheumatoid Arthritis",4297651,"Rheumatoid arthritis with nailfold and finger-pulp infarcts","S","V","402433007","SNOMED"
67,"[C02][AI2] Rheumatoid Arthritis",4299308,"Rheumatoid neutrophilic dermatitis","S","V","402432002","SNOMED"
67,"[C02][AI2] Rheumatoid Arthritis",4300202,"Rheumatoid episcleritis","S","V","77522006","SNOMED"
67,"[C02][AI2] Rheumatoid Arthritis",4306357,"Rheumatoid aortitis","S","V","38877003","SNOMED"
67,"[C02][AI2] Rheumatoid Arthritis",4311391,"Uveitis-rheumatoid arthritis syndrome","S","V","86219005","SNOMED"
67,"[C02][AI2] Rheumatoid Arthritis",4347065,"Rheumatoid necrotizing vasculitis","S","V","239943002","SNOMED"
67,"[C02][AI2] Rheumatoid Arthritis",35327341,"Rheumatoid bursitis","C","V","10086279","MedDRA"
67,"[C02][AI2] Rheumatoid Arthritis",35609009,"Rheumatoid arthritis of left shoulder","S","V","1073741000119109","SNOMED"
67,"[C02][AI2] Rheumatoid Arthritis",35609010,"Rheumatoid arthritis of right shoulder","S","V","1073821000119109","SNOMED"
67,"[C02][AI2] Rheumatoid Arthritis",36009832,"Laryngeal rheumatoid arthritis","C","V","10059669","MedDRA"
67,"[C02][AI2] Rheumatoid Arthritis",36683391,"Rheumatoid arthritis of joint of spine","S","V","781206002","SNOMED"
67,"[C02][AI2] Rheumatoid Arthritis",36684998,"Seropositive rheumatoid arthritis of shoulder joint","S","V","459921000124108","SNOMED"
67,"[C02][AI2] Rheumatoid Arthritis",36685017,"Rheumatoid arthritis of left ankle","S","V","1073681000119109","SNOMED"
67,"[C02][AI2] Rheumatoid Arthritis",36685018,"Rheumatoid arthritis of left elbow","S","V","1073691000119107","SNOMED"
67,"[C02][AI2] Rheumatoid Arthritis",36685019,"Rheumatoid arthritis of left foot","S","V","1073701000119107","SNOMED"
67,"[C02][AI2] Rheumatoid Arthritis",36685020,"Rheumatoid arthritis of left wrist","S","V","1073751000119106","SNOMED"
67,"[C02][AI2] Rheumatoid Arthritis",36685021,"Rheumatoid arthritis of right ankle","S","V","1073761000119108","SNOMED"
67,"[C02][AI2] Rheumatoid Arthritis",36685022,"Rheumatoid arthritis of right elbow","S","V","1073771000119102","SNOMED"
67,"[C02][AI2] Rheumatoid Arthritis",36685023,"Rheumatoid arthritis of right foot","S","V","1073781000119104","SNOMED"
67,"[C02][AI2] Rheumatoid Arthritis",36685024,"Rheumatoid arthritis of right wrist","S","V","1073831000119107","SNOMED"
67,"[C02][AI2] Rheumatoid Arthritis",36686999,"Rheumatoid arthritis of bilateral temporomandibular joints","S","V","15685921000119102","SNOMED"
67,"[C02][AI2] Rheumatoid Arthritis",36687000,"Rheumatoid arthritis of right temporomandibular joint","S","V","15685961000119107","SNOMED"
67,"[C02][AI2] Rheumatoid Arthritis",36687001,"Rheumatoid arthritis of left temporomandibular joint","S","V","15686001000119104","SNOMED"
67,"[C02][AI2] Rheumatoid Arthritis",36687002,"Rheumatoid arthritis of bilateral elbows","S","V","15686321000119106","SNOMED"
67,"[C02][AI2] Rheumatoid Arthritis",36687003,"Rheumatoid arthritis of bilateral hips","S","V","15687841000119108","SNOMED"
67,"[C02][AI2] Rheumatoid Arthritis",36687005,"Rheumatoid arthritis of bilateral ankles","S","V","15691721000119102","SNOMED"
67,"[C02][AI2] Rheumatoid Arthritis",36687006,"Rheumatoid arthritis of bilateral wrists","S","V","15691761000119107","SNOMED"
67,"[C02][AI2] Rheumatoid Arthritis",37108590,"Rheumatoid arthritis of left knee","S","V","1073731000119100","SNOMED"
67,"[C02][AI2] Rheumatoid Arthritis",37108591,"Rheumatoid arthritis of right knee","S","V","1073811000119102","SNOMED"
67,"[C02][AI2] Rheumatoid Arthritis",37108714,"Seropositive rheumatoid arthritis of multiple joints","S","V","11055151000119108","SNOMED"
67,"[C02][AI2] Rheumatoid Arthritis",37117421,"Rheumatoid arthritis in remission","S","V","143441000119108","SNOMED"
67,"[C02][AI2] Rheumatoid Arthritis",37160376,"Seronegative erosive rheumatoid arthritis","S","V","1162303002","SNOMED"
67,"[C02][AI2] Rheumatoid Arthritis",37160384,"Rheumatoid factor and anti-citrullinated protein antibody positive rheumatoid arthritis","S","V","1162313005","SNOMED"
67,"[C02][AI2] Rheumatoid Arthritis",37160390,"Rheumatoid factor and anti-citrullinated protein antibody positive erosive rheumatoid arthritis","S","V","1162319009","SNOMED"
67,"[C02][AI2] Rheumatoid Arthritis",37160399,"Anti-citrullinated protein antibody positive erosive rheumatoid arthritis","S","V","1162336001","SNOMED"
67,"[C02][AI2] Rheumatoid Arthritis",37160417,"Felty syndrome with seronegative erosive rheumatoid arthritis","S","V","1162362005","SNOMED"
67,"[C02][AI2] Rheumatoid Arthritis",37160421,"Felty syndrome with seronegative rheumatoid arthritis","S","V","1162364006","SNOMED"
67,"[C02][AI2] Rheumatoid Arthritis",37160562,"Rheumatoid arthritis with rheumatoid lung disease","S","V","1162677006","SNOMED"
67,"[C02][AI2] Rheumatoid Arthritis",37163922,"Autoimmune interstitial lung disease, arthritis syndrome","S","V","1222679006","SNOMED"
67,"[C02][AI2] Rheumatoid Arthritis",37207804,"Seropositive rheumatoid arthritis of left hip","S","V","318871000119107","SNOMED"
67,"[C02][AI2] Rheumatoid Arthritis",37207805,"Seropositive rheumatoid arthritis of left knee","S","V","318881000119105","SNOMED"
67,"[C02][AI2] Rheumatoid Arthritis",37207806,"Seropositive rheumatoid arthritis of right hip","S","V","318941000119109","SNOMED"
67,"[C02][AI2] Rheumatoid Arthritis",37207807,"Seropositive rheumatoid arthritis of right knee","S","V","318951000119106","SNOMED"
67,"[C02][AI2] Rheumatoid Arthritis",37207808,"Seronegative rheumatoid arthritis of left hand","S","V","319031000119108","SNOMED"
67,"[C02][AI2] Rheumatoid Arthritis",37207809,"Seronegative rheumatoid arthritis of multiple joints","S","V","319081000119109","SNOMED"
67,"[C02][AI2] Rheumatoid Arthritis",37207810,"Seronegative rheumatoid arthritis of right hand","S","V","319111000119104","SNOMED"
67,"[C02][AI2] Rheumatoid Arthritis",37209321,"Bilateral rheumatoid arthritis of feet","S","V","15686281000119101","SNOMED"
67,"[C02][AI2] Rheumatoid Arthritis",37209322,"Bilateral rheumatoid arthritis of knees","S","V","15687201000119107","SNOMED"
67,"[C02][AI2] Rheumatoid Arthritis",37209323,"Bilateral rheumatoid arthritis of hands","S","V","15687321000119109","SNOMED"
67,"[C02][AI2] Rheumatoid Arthritis",37209328,"Seronegative rheumatoid arthritis of bilateral hands","S","V","15691161000119108","SNOMED"
67,"[C02][AI2] Rheumatoid Arthritis",37209329,"Seropositive rheumatoid arthritis of bilateral hands","S","V","15691801000119104","SNOMED"
67,"[C02][AI2] Rheumatoid Arthritis",42534834,"Rheumatoid arthritis of left hand","S","V","1073711000119105","SNOMED"
67,"[C02][AI2] Rheumatoid Arthritis",42534835,"Rheumatoid arthritis of left hip","S","V","1073721000119103","SNOMED"
67,"[C02][AI2] Rheumatoid Arthritis",42534836,"Rheumatoid arthritis of right hand","S","V","1073791000119101","SNOMED"
67,"[C02][AI2] Rheumatoid Arthritis",42534837,"Rheumatoid arthritis of right hip","S","V","1073801000119100","SNOMED"
67,"[C02][AI2] Rheumatoid Arthritis",42539550,"Rheumatoid arthritis with erosion of joint","S","V","735599007","SNOMED"
